{
  "schemaVersion": "v1",
  "protocolVersion": "v1",
  "recorderId": "recorder-lab-0001",
  "bootId": "boot-0001",
  "sequence": 42,
  "occurredAt": "2026-07-17T00:00:00Z",
  "time": {
    "state": "synchronized",
    "sourceId": "ntp-source-primary",
    "offsetMs": 0.12,
    "uncertaintyMs": 0.8,
    "lastSyncAt": "2026-07-17T00:00:00Z"
  },
  "runtime": {
    "state": "ready",
    "version": "0.1.0"
  }
}
